{
  "bundle_version": "0.4.0",
  "exported_at": "2026-03-18T12:00:00Z",
  "memory": {
    "id": "11111111-1111-1111-1111-111111111111",
    "project_id": "festie",
    "memory_type": "decision",
    "title": "Use Spotify Web API",
    "summary": "Selected Spotify Web API for playlists.",
    "content": "Use Spotify Web API with trust-aware memory export flow.",
    "tags": [
      "spotify",
      "decision"
    ],
    "status": "verified",
    "confidence": 0.92,
    "importance": 9,
    "source": "manual",
    "source_ref": null,
    "evidence_url": "https://example.com/evidence",
    "evidence_hash": "sha256:evidencehash",
    "trust_level": "validated",
    "authority_level": "approved",
    "checksum": "sha256:memorychecksum",
    "created_at": "2026-03-18T12:00:00Z",
    "updated_at": "2026-03-18T12:00:00Z"
  },
  "manifest": {
    "memory_checksum": "sha256:memorychecksum",
    "payload_checksum": "sha256:payloadchecksum",
    "signature_algorithm": "ed25519",
    "public_key_hint": "memory-public.pem"
  },
  "signature": {
    "algorithm": "ed25519",
    "value": "ZmFrZS1zaWduYXR1cmU="
  }
}